{
  "name": "demo",
  "spf": "${ROOT}/demo.spf",
  "root": "${ROOT}",
  "synthesizable": [
    {
      "role": "synthesizable",
      "path": "${ROOT}/rtl/contador.v",
      "top_level": true
    },
    {
      "role": "synthesizable",
      "path": "${ROOT}/rtl/somador.v",
      "top_level": false
    },
    {
      "role": "synthesizable",
      "path": "${ROOT}/rtl/mux.sv",
      "top_level": false
    },
    {
      "role": "synthesizable",
      "path": "${ROOT}/soma/soma/soma.v",
      "top_level": false
    },
    {
      "role": "synthesizable",
      "path": "${ROOT}/filtro/filtro/filtro.v",
      "top_level": false
    }
  ],
  "testbench": [
    {
      "role": "testbench",
      "path": "${ROOT}/tb/contador_tb.v",
      "top_level": false
    },
    {
      "role": "testbench",
      "path": "${ROOT}/tb/somador_tb.v",
      "top_level": true
    },
    {
      "role": "testbench",
      "path": "${ROOT}/soma/soma/soma_tb.v",
      "top_level": false
    },
    {
      "role": "testbench",
      "path": "${ROOT}/filtro/filtro/filtro_tb.v",
      "top_level": false
    }
  ],
  "top_level": "${ROOT}/rtl/contador.v",
  "top_module": "contador",
  "selected_testbench": "${ROOT}/tb/somador_tb.v",
  "testbench_module": "somador_tb",
  "unregistered": [
    "${ROOT}/rtl/sobra.v",
    "${ROOT}/rtl/velho_tb.v"
  ],
  "here": null,
  "processors": [
    {
      "name": "soma",
      "language": "cmm",
      "dir": "${ROOT}/soma",
      "source": "${ROOT}/soma/soma.cmm",
      "output_dir": "${ROOT}/soma/soma",
      "temp_dir": "${ROOT}/.aurora8/Temp/soma",
      "frequency_mhz": 100,
      "clocks": 2000,
      "show_arrays": false,
      "built": true
    },
    {
      "name": "filtro",
      "language": "cmm",
      "dir": "${ROOT}/filtro",
      "source": "${ROOT}/filtro/filtro.cmm",
      "output_dir": "${ROOT}/filtro/filtro",
      "temp_dir": "${ROOT}/.aurora8/Temp/filtro",
      "frequency_mhz": 100,
      "clocks": 2000,
      "show_arrays": false,
      "built": true
    }
  ],
  "issues": []
}
